id,제목,질문,예상답변,정답,target_found,target_rank,target_score,문서1,점수1,문서2,점수2,문서3,점수3,문서4,점수4,문서5,점수5,문서6,점수6,문서7,점수7,문서8,점수8,문서9,점수9,문서10,점수10
301,"미국 FDA, 2017년 12월 수입부적합(25)","WOORI FOOD .,LTD.의 콘칩이 미국 FDA에 의해 부적합 판정을 받은 이유는 무엇인가?",해당 문서에 없음.,유해 색소첨가물이 포함되었을 가능성이 있어 부적합 판정을 받았다.,True,1,7.700881481170654,"[1] 미국 FDA, 2017년 12월 수입부적합(25)  -제조사식별번호: 3011401885-제조사명: WOORI FOOD .,LTD.  -주소지 1: 339-5  -주소지 2: -도시명: Anseong-Si  -지역명: Gyeonggido  -국가: 대한민국-제품코드: 07AGT02  -제품설명: 콘칩, 구운 형태 (CORN CHIPS, BAKED)-부적합일자: 2017-12-12-FDA 지역사무소: DNEI  -통관 식별번호/참고문서/라인번호/기타: U47-0709167-2/211/1-검체분석: 아니오-사설실험실분석: 아니오-부적합...",7.700881481170654,"[2] 미국  상원의원, 식품의약품청에 식품안전영양센터의 지연 및 부작위에 대한 즉각적인 조치 및 답변을 요구하는 서한 발송 미국 상원보건교육노동연금(HELP)위원회 의장인 Patty Murray 상원의원은 가족의 건강과 안전을 위험에 빠뜨리는 미국 식품의약품청(FDA) 식품안전영양센터의 지연 및 부작위 문화를 드러낸 Politico의 보고서에 대한 답변과 즉각적인 조치를 촉구하는 서한을 미국 식품의약품청(FDA) 청장 Robert M. Califf에 발송했음. Patty Murray 의원은 서한을 통해 다음에 대한 답변을 2022년 4월...",-9.023873329162598,"[3] 미국 FDA, 전장유전체 서열분석법으로 식품 안전 보장 전장유전체 서열분석법(WGS, Whole genome sequencing)은 식품을 오염시키고 발병 사건을 유발하는 미생물의 특성과 출처 파악 등, 식인성 병원균의 보다 나은 이해를 위해 미국 식품의약품청(FDA)의 활용빈도가 높아지고 있는 선진 기술임. 그 예로, 전장유전체 서열분석법은 최근 3월 초 집단 식중독에 관계된 리스테리아 모노사이토제네스의 유전자 지문을 연질치즈 샘플과 매치시키는데도 도움이 되었음. FDA는 연방, 주, 국제 차원의 정부 실험실에서 이 기술의 사용이...",-9.632119178771973,"[4] 미국 공익과학센터, 소비자의 올바른 구매를 위한 안내책자 발간 매년 4800만명의 미국인이 오염된 식품으로 식중독 증세를 겪게 될 것이며 식품매개 질병으로 3,000명이 사망할 것임. 때때로 ""식품 경찰""로 불리는 비영리 식품안전 감시 단체 '공익과학센터(CSPI)'는 오늘 과학적 근거에 바탕을 두고 식품을 어떻게 안전하게 구매하고, 준비하고, 조리하고, 보관하는 지에 대한 권고를 담아 식품매개 질병을 기피하기 위한 최종 소비자 지침을 발행함. 수석식품안전 변호인 사라 클레인이 저술한 ""슈퍼마켓에서 잔여 음식까지(From Super...",-9.821059226989746,"[5] 홍콩 입법회, 보건식품 감독관리 관련 질의응답  다음은 금일(6월 5일), 입법회 회의에서 천카이신(陳凱欣) 의원의 질의와 루충마오(盧寵茂) 의무위생국장의 서면 답변 내용임. <질의>보도에 따르면, 앞서 해외에서 보건식품 섭취 후 신장병 및 사망 사례가 발생함. 관련 업체는 해당 제품이 홍콩에 수입되지 않았다고 언급했으나, 시중에 병행수입제품이 나타날 수도 있음. 한편 홍콩 시중 보건식품은 '약제업 및 독약 조례'(제138장), '중의약 조례'(제549조), '불량광고(의약) 조례'(제231장) 등 다양한 조례의 감독관리를 받고 있...",-9.822293281555176,"[6] 유럽집행위원회, EU 내 동물복지 플랫폼 발족 관련 질의응답 *5월15일자 기수집정보 ""유럽집행위원회, EU 내 동물 복지 플랫폼 발족"" 관련유럽집행위원회는 오늘(현지시각), 동물복지에 관한 EU 플랫폼 첫 회의를 공식적으로 개최했음. 이는 관련 이해관계자, NGO, 과학자, 회원국, EEA, 국제기구, 유럽식품안전청 등의 대표 75명과 함께 하며, 동물 복지 향상 및 경험 공유를 위한 자리임. 관련 질문 내용은 다음과 같음(답변은 원문 참고).1. 유럽집행위원회의 플랫폼 발족 이유2. 동 플랫폼의 멤버는 누구인가3. 멤버는 어떤 ...",-9.824514389038086,"[7] 벨기에 연방식품안전청, Ferrero(사) 초콜릿 관련 살모넬라증 감염에 관한 FAQ 게재  ​벨기에 연방식품안전청(이하 AFSCA)는 Ferrero(사) 초콜릿 관련 살모넬라증 감염에 관한 FAQ(*)를 게재함  1. 살모넬라증은 무엇인가?살모넬라증은 살모넬라균 또는 살모넬라균에 의한 식품 오염임. 다양한 종류의 살모넬라균이 있으며, 이러한 살모넬라균은 주로 사람의 소화관을 감염시키고 위장염을 유발함. 살모넬라증은 대부분 치료 없이 해결되나, 취약하거나 쇠약해진 사람들의 경우 살모넬라증이 심각한 형태로 발전할 수 있음. 증상이 심...",-9.824553489685059,"[8] 독일 BfR, 내분비계 장애물질 평가 원칙에 대한 과학적 논의 독일 연방위해평가원(BfR)은 2016년 4월 12일 개최된 내분비계 장애물질에 대한 전문가 회의에 대해 안내함.  동 회의는 BfR이 주최하였으며, 내분비계 장애물질에 대한 과학적이고 건설적인 논의를 추진하기 위함임. 어떤 제품의 사용으로 인한 소비자 건강 리스크 발생 여부에 대한 평가에는 해당 제품에 함유되어 있을 수 있는 내분비계 장애물질에 대한 과학적 평가가 제출되어야 함. 현재 이 분야의 연구를 진행하고 있는 과학자들은 호르몬-손상-물질 평가 원칙에 대해 서로 ...",-9.824559211730957,"[9] 세계보건기구, 후쿠시마 원전사고 5주기 맞아 관련 Q&A 발표  2011년 3월 11일, 일본 동쪽 연안에서 규모 9의 지진으로 심각한 피해를 입힌 쓰나미가 발생한 바 있음. 아래의 10가지 질문과 답변은 후쿠시마 원전 사고가 공중 보건에 미치는 영향을 완화시키기 위한 세계보건기구(WHO)의 대응 방법과 대책에 관해 서술함. 질문 내용은 다음과 같음(7번 이외의 답변 내용은 원문 참고).1. 무슨 일이 있었는가2. 사람들에 노출된 주요 방사성 핵종은 무엇인가3. 사람들에 노출된 방사선 수준은 어느 정도인가4. 동 재해로 인한 주요 ...",-9.824575424194336,,
302,"미국 항소법원, 환경보호청에 클로르피리포스 사용 중단 명령",미국 항소법원이 환경보호청에 클로르피리포스를 금지하라고 명령한 이유는 무엇인가?,"미국 항소법원은 환경보호청(EPA)이 클로르피리포스의 잠재적인 위험성에 대한 과학적 근거를 충분히 평가하지 않았으며, 특히 어린이 뇌 발달에 대한 부정적 영향을 무시하거나 부실하게 다룬 점을 이유로 클로르피리포스 사용 금지를 명령하였음.",클로르피리포스가 어린이의 뇌발달 손상을 야기할 수 있다는 과학적 근거에 부실하게 대응했기 때문임.,True,1,9.894381523132324,"[1] 미국 항소법원, 환경보호청에 클로르피리포스 사용 중단 명령 미국 항소법원이 목요일(현지 시간), 환경보호청(EPA)에 농약 '클로르피리포스'를 금지하라는 명령을 내렸음. 제9 순회항소법원의 이번 판결은 식용 작물(과일, 채소, 견과 등)에 대한 클로르피리포스 사용을 금지하라는 환경보호단체들의 청원을 2017년 3월, 청장이 거절한 것을 뒤엎은 것임. 환경단체 얼스저스티스(Earthjustice)의 변호사는 ""이는 클로르피리포스가 어린이 뇌에 손상을 입한다는 과학정보를 단순히 청이 무시할 수 없다는 점을 보여준다. 트럼프 행정부는 모...",9.894381523132324,"[2] 미국 법원, 환경보호청에 논란이 많은 제초제 금지 관련 최종 결정 요구 미 항소법원이 환경보호청에 어린이 발달 장애와 관련된 한 농약성분의 사용을 금지할지 여부에 대한 최종 결정을 내리도록 하였음. 제9 순회항소법원이 금요일(현지시간) 환경보호청에 미국에서 클로르피리포스 사용을 금지할 것인지에 대한 최종 결정을 내리도록 명함에 따라, 환경보호청은 7월중순까지 이를 이행하여야 함. 클로르피리포스는 사과와 오렌지, 딸기, 옥수수 및 밀 작물에 일반적으로 사용되는 농업 화학성분으로, 식품에 사용된 오랜 역사를 가지고 있음. 많은 과학 연...",9.882607460021973,"[3] 미국 환경보호청, 클로르피리포스 사용 금지하라는 법원 판결 재고 설득에 성공 미국 환경보호청이 클로르피리포스를 금지하라는 최근 법원의 명령을 항소법원이 재심하도록 하는데 성공했음. 제9 순화항소법원은 수요일, 과일과 채소, 견과와 같은 식용 작물에 대한 클로르피리포스 사용 금지에 관한 전(former) 환경보호청장의 번복 결정을 재검토하겠다고 밝혔음. 당시 청장의 결정은 대부분의 가정에서 사용되는 농약인 클로르피리포스에 관한 2000년의 금지 결정을 확대하기 위해 2015년 오바마 행정부가 세웠던 계획을 뒤짚는 것이었음. 한편, 지...",9.877172470092773,"[4] 미국 연방법원, 미국 환경보호청에 클로르피리포스 사용을 금지하거나 안전하다고 결정하도록 지시 *기수집정보 1) 미국 환경보호청, 클로르피리포스 위험 평가 초안 발표(수집일자: 2020-09-23)2) 미국 환경보호청, 클로르피리포스에 대한 새로운 안전 조치 제안(수집일자: 2020-12-07)3) 미국 환경보호청, 클로르피리포스 위험 평가 초안 및 제안된 임시결정에 관한 의견수렴 기한 연장(수집일자: 2021-02-08)4) 미국 어스저스티스 단체, 100개 이상의 단체가 바이든 행정부에게 클로르피리포스 금지 촉구(수집일자: 202...",9.64841079711914,"[5] 미국 항소법원, 환경보호단체의 클로르피리포스 사용 금지 청원 기각 미국 항소법원은 화요일(현지시간), 환경보호청(EPA)의 클로르피리포스 금지를 요구한 환경보건단체의 청원을 기각했음. 제9순회항소법원은 얼스저스티스'와 '천연자원보호협의회' 등이 포함된 환경보호단체들의 청원을 기각했음. 이들 단체는 청이 이 문제를 조치하는데 시간을 끌고 있다고 전했음. 앞서 법원은 클로르피리포스에 대해 10년 전에 제출된 청원에 대한 최종 결정을 발표하도록 명했음. 질병통제예방센터 산하의 '독성물질질병등록청'은 클로르피리포스를 신경독소로 간주함. 3...",9.292244911193848,"[6] 미국 법무부, 클로르피리포스 금지에 관한 항소법원 명령에 재심 요구 * 2018.08.09 관련 기수집정보 ""미국 항소법원, 환경보호청에 클로르피리포스 사용 중단 명령"" 미국 법무부는 클로르피리포스 농약 금지를 환경보호청(EPA)에 명령한 연방 항소법원의 명령에 재심리를 요구함. 법무부 담당 검사들은 샌프란시스코 연방지법 제 9차 순회재판소가 스캇 프루이트 전 환경보호청장이 2017년, 발달과 신경 장애와 관련이 있는 클로르피리포스의 금지에 관한 청원을 부당하게 거절했다는 판결을 내릴 당시, 대법원의 판례와 근거 법령을 모두 어겼다...",9.282710075378418,"[7] 미국 환경보호단체, 환경보호청에 클로르피리포스 사용 금지 청원 환경보호단체들이 수요일(현지시간), 환경보호청(EPA)이 클로르피리포스의 안전성을 입증하지 못할 경우 30일 내에 식품에 사용을 금지하고 60일 내에 모든 용도에 대해 사용을 금지하도록 법원이 개입해 청에 명령할 것을 요구(*)했음. 지난주 청은 청의 내부 안전전문가가 클로르피리포스를 불법화해야 한다고 밝혔음에도 불구하고 사용 금지 청원을 거절했음. 청장은 클로르피리포스의 안전성엥 관한 새로운 근거를 제시하지 않았으며, 재평가 완료기한인 2022년까지 청이 클로르피리포스...",7.894529819488525,"[8] 미국 6개주, 뇌 질환 연관성 제기된 클로르피리포스 허가 관련 환경보호청 고소해 미국의 6개 주(캘리포니아, 뉴욕, 매사추세츠, 워싱턴, 메릴랜드, 버몬트)는  뇌 손상과 관련된 흔한 살충제인 클로르피리포스의 추가 사용을 허용한 것에 대해 환경보호청(EPA)을 고소했음.  환경단체 ‘Earthjustice’가 환경운동가, 농장 근로자, 학습장애인을 옹호하는 단체들을 대표하여 제9회 순회 항소법원(9th Circuit Court of Appeals)에 유사한 소송을 제기한 바 있음. 미국 학습장애인협회 ‘Tracy Gregoire’는...",6.735327243804932,"[9] 미국 환경실무단, 농산물 산업체에 클로르피리포스 관련 연방법원 판결 지지 촉구 *기수집정보 1) 미국 환경보호청, 클로르피리포스 위험 평가 초안 발표(수집일자: 2020-09-23)2) 미국 환경보호청, 클로르피리포스에 대한 새로운 안전 조치 제안(수집일자: 2020-12-07)3) 미국 환경보호청, 클로르피리포스 위험 평가 초안 및 제안된 임시결정에 관한 의견수렴 기한 연장(수집일자: 2021-02-08)4) 미국 어스저스티스 단체, 100개 이상의 단체가 바이든 행정부에게 클로르피리포스 금지 촉구(수집일자: 2021-03-06)...",3.947303295135498,,
303,"미국 FDA, 2018년 3월 수입부적합(6)",SANGJU SAENURI GOTGAM의 감 제품이 부적합 판정을 받은 이유는 무엇인가요?,해당 문서에 없음.,"유해 농약이 함유된 농산품으로, 식의약화장품법 관련 조항 402(a)(2)(B), 801(a)(3)에 의거하여 변질로 인한 부적합 판정을 받았습니다.",True,2,4.331257343292236,"[1] 미국 FDA, 2018년 3월 수입부적합(5)  -제조사식별번호: 3014197227-제조사명: SANGJU SAENURI GOTGAM  -주소지 1: Deogam-Ro  -주소지 2: Jumgdong-Myeon  -도시명: Sangju-Si  -지역명: Gyeongsangbugdo  -국가: 대한민국-제품코드: 22HGH02  -제품설명: 감, 건조 또는 으깬 것 (PERSIMMON, DRIED OR PASTE)-부적합일자: 2018-03-06-FDA 지역사무소: DWCI  -통관 식별번호/참고문서/라인번호/기타: U47-0800...",4.430478096008301,"[2] 미국 FDA, 2018년 3월 수입부적합(6)  -제조사식별번호: 3014197227-제조사명: SANGJU SAENURI GOTGAM  -주소지 1: Deogam-Ro  -주소지 2: Jumgdong-Myeon  -도시명: Sangju-Si  -지역명: Gyeongsangbugdo  -국가: 대한민국-제품코드: 22HGH02  -제품설명: 감, 건조 또는 으깬 것 (PERSIMMON, DRIED OR PASTE)-부적합일자: 2018-03-06-FDA 지역사무소: DWCI  -통관 식별번호/참고문서/라인번호/기타: U47-0800...",4.331257343292236,"[3] 미국 FDA, 2018년 3월 수입부적합(4)  -제조사식별번호: 3014197227-제조사명: SANGJU SAENURI GOTGAM  -주소지 1: Deogam-Ro  -주소지 2: Jumgdong-Myeon  -도시명: Sangju-Si  -지역명: Gyeongsangbugdo  -국가: 대한민국-제품코드: 22HGH02  -제품설명: 감, 건조 또는 으깬 것 (PERSIMMON, DRIED OR PASTE)-부적합일자: 2018-03-06-FDA 지역사무소: DWCI  -통관 식별번호/참고문서/라인번호/기타: U47-0800...",4.314929485321045,"[4] 미국 공익과학센터, 소비자의 올바른 구매를 위한 안내책자 발간 매년 4800만명의 미국인이 오염된 식품으로 식중독 증세를 겪게 될 것이며 식품매개 질병으로 3,000명이 사망할 것임. 때때로 ""식품 경찰""로 불리는 비영리 식품안전 감시 단체 '공익과학센터(CSPI)'는 오늘 과학적 근거에 바탕을 두고 식품을 어떻게 안전하게 구매하고, 준비하고, 조리하고, 보관하는 지에 대한 권고를 담아 식품매개 질병을 기피하기 위한 최종 소비자 지침을 발행함. 수석식품안전 변호인 사라 클레인이 저술한 ""슈퍼마켓에서 잔여 음식까지(From Super...",-9.818166732788086,"[5] 홍콩 입법회, 보건식품 감독관리 관련 질의응답  다음은 금일(6월 5일), 입법회 회의에서 천카이신(陳凱欣) 의원의 질의와 루충마오(盧寵茂) 의무위생국장의 서면 답변 내용임. <질의>보도에 따르면, 앞서 해외에서 보건식품 섭취 후 신장병 및 사망 사례가 발생함. 관련 업체는 해당 제품이 홍콩에 수입되지 않았다고 언급했으나, 시중에 병행수입제품이 나타날 수도 있음. 한편 홍콩 시중 보건식품은 '약제업 및 독약 조례'(제138장), '중의약 조례'(제549조), '불량광고(의약) 조례'(제231장) 등 다양한 조례의 감독관리를 받고 있...",-9.822918891906738,"[6] 중국, ""식품.보건식품 사기 및 허위선전 관리 문답(Q&A)"" 발표 식품·보건식품 사기 및 허위선전 관리업무를 발전시키고 각지역 관리업무에 대한 지도를 강화하기 위하여, 전국 식품·보건식품 사기 및 허위선전 관리업무 영도소조(지도그룹) 판공실이 ""식품·보건식품 사기 및 허위선전 관리 문답(QA)""(*)을 마련함. 기본상식, 생산·경영허가, 라벨표시, 특수식품, 수입식품, 허위선전, 사기판매, 광고심사와 관리감독, 불법첨가, 검사 등 방면에서 관련 법률·법규, 규정 등을 문답(QA) 방식으로 체계적으로 정리하여 각지역 관리감독당국이 ...",-9.823028564453125,"[7] 독일 BMEL, 글리포세이트에 대한 Q/A 발표  독일 연방식품농업부(BMEL)은 글리포세이트에 대한 Q/A를 발표함. 1. 글리포세이트는 무엇인가?2. 글리포세이트는 어떤 영향을 주는가?3. 언제부터 독일에서 글리포세이트가 사용되었는가?4. 독일에서 누가 글리포세이트를 사용하는가?5. 농업계에 글리포세이트와 관련하여 어떤 사용 제한이 있는가?6. 농업계에서 사용되는 글리포세이트가 함유된 작물보호제의 대안은 무엇인가?7. 농업계에서 글리포세이트 사용은 벌에게 어떤 영향을 미치는가?8. 글리포세이트는 비농작지에서 사용 가능한가?9. ...",-9.824193000793457,"[8] 독일 BMEL, 글리포세이트에 대해 Q&A 발표 독일 연방식품농업부(BMEL)는 글리포세이트에 대해 QA(*)를 발표함. 그에 대한 질문은 다음과 같음. 1)글리포세이트란 무엇인가?2)글리포세이트는 어떻게 작용하는가?3)독일에서 글리포세이트는 언제부터 사용되었는가?4)독일에서 글리포세이트를 사용하는 사람은 누구인가?5)어떤 제한이 글리포세이트의 사용에 대해 농업에서 존재하는가?6)농업에서 글리포세이트 함유 살충제의 대안은 무엇인가?7)농업에서 글리포세이트의 사용은 벌에 어떤 영향을 주는가?8)글리포세이트를 비농업 토지에 사용할 수 ...",-9.824302673339844,"[9] 유럽집행위원회, EU 내 동물복지 플랫폼 발족 관련 질의응답 *5월15일자 기수집정보 ""유럽집행위원회, EU 내 동물 복지 플랫폼 발족"" 관련유럽집행위원회는 오늘(현지시각), 동물복지에 관한 EU 플랫폼 첫 회의를 공식적으로 개최했음. 이는 관련 이해관계자, NGO, 과학자, 회원국, EEA, 국제기구, 유럽식품안전청 등의 대표 75명과 함께 하며, 동물 복지 향상 및 경험 공유를 위한 자리임. 관련 질문 내용은 다음과 같음(답변은 원문 참고).1. 유럽집행위원회의 플랫폼 발족 이유2. 동 플랫폼의 멤버는 누구인가3. 멤버는 어떤 ...",-9.82454776763916,,
