id,제목,질문,예상답변,정답,target_found,target_rank,target_score,문서1,점수1,문서2,점수2,문서3,점수3,문서4,점수4,문서5,점수5,문서6,점수6,문서7,점수7,문서8,점수8,문서9,점수9,문서10,점수10
0,"[회수]캐나다 Ocean Pier Inc., 미표시된 알레르기 유발물질 겨자 존재로 그라탕 회수",Cauliflower Gratin 제품의 회수 사유는 무엇인가요?,(LLM 비활성화: 근거 문서만 제공),미표시된 알레르기 유발물질 겨자 존재,True,2,8,"[1] 아일랜드 식품안전청, 오포장으로 인한 알레르겐 밀&달걀 미표시로 즉석식품 경고 - 일자: 2022.11.21- 공고번호: 2022.A34- 제품: Avoca to Go Baked Buffalo Cauliflower; pack size: 580g; use by date: 23/11/2022- 사유: 상기 제품이 Cauliflower Cheddar Gratin으로 오포장되어 알레르겐 밀 및 달걀 함유를 미표시함- 제품사진: 원문 참조...",9,"[2] [회수]캐나다 Ocean Pier Inc., 미표시된 알레르기 유발물질 겨자 존재로 그라탕 회수 -발생일자 : 2022.1.13(발표일자 : 2022.1.17)-지역 : 캐나다 전역-제품명 : Cauliflower Gratin (브랜드 : MM Food Market, 중량 : 500g, 제품코드 : 3181, UPC : 6 61815 01851 4-회수사 : Ocean Pier Inc.-회수사유 : 미표시된 알레르기 유발물질 겨자 존재 -제품사진 : -...",8,"[3] 벨기에 연방식품안전청, Ferrero(사) 초콜릿 관련 살모넬라증 감염에 관한 FAQ 게재  ​벨기에 연방식품안전청(이하 AFSCA)는 Ferrero(사) 초콜릿 관련 살모넬라증 감염에 관한 FAQ(*)를 게재함  1. 살모넬라증은 무엇인가?살모넬라증은 살모넬라균 또는 살모넬라균에 의한 식품 오염임. 다양한 종류의 살모넬라균이 있으며, 이러한 살모넬라균은 주로 사람의 소화관을 감염시키고 위장염을 유발함. 살모넬라증은 대부분 치료 없이 해결되나, 취약하거나 쇠약해진 사람들의 경우 살모넬라증이 심각한 형태로 발전할 수 있음. 증상이 심...",7,"[4] 중국  상하이해관수출입안전처, 수입식품에 관한 문답(국가표준체계편) 상하이해관 수출입식품안전처(上海海关进出口食品安全处)는 수입식품에 관한 문답(국가표준체계편)을 제공함.Q1. 중국 식품안전표준은 어떠한 내용을 포괄하고 있는가?-중국 식품안전 국가표준의 내용은 8개 부분을 포함하고 있음1) 식품, 식품첨가물, 식품 관련 제품 중 병원성 미생물, 농약잔류, 동물용의약품잔류, 생물독소, 중금속 등 오염물질 및 기타 인체건강 위해물질의 제한량 규정2) 식품첨가물의 품목, 사용범위, 사용량3) 영유아 및 기타 특정집단 전용 주보조식품의 영양...",6,"[5] 미국 식품의약품청, 한눈에 보는 '식품분석용 검사실 승인(LAAF)에 관한 최종규칙' 게시 *기수집정보: 미국 식품의약품청, 식품 분석용 검사실 인증 프로그램 수립에 대한 최종규칙 발표(수집일자: 2021-12-02)  미국 식품의약품청(FDA)은 '식품분석용 검사실 승인과 관련된 식품안전현대화법(FSMA) 최종규칙'에 대해 '한눈에 알아보는 자료표(*)'를 게시함. 최종규칙은 특정 상황에서 식품을 검사하기 위한 실험실 승인 프로그램을 수립함. 동 자료표에는 다음과 같은 내용이 들어있음.- 동 최종규칙의 영향을 받는 사람은 누구인가...",5,"[6] 미국  상원의원, 식품의약품청에 식품안전영양센터의 지연 및 부작위에 대한 즉각적인 조치 및 답변을 요구하는 서한 발송 미국 상원보건교육노동연금(HELP)위원회 의장인 Patty Murray 상원의원은 가족의 건강과 안전을 위험에 빠뜨리는 미국 식품의약품청(FDA) 식품안전영양센터의 지연 및 부작위 문화를 드러낸 Politico의 보고서에 대한 답변과 즉각적인 조치를 촉구하는 서한을 미국 식품의약품청(FDA) 청장 Robert M. Califf에 발송했음. Patty Murray 의원은 서한을 통해 다음에 대한 답변을 2022년 4월...",4,"[7] [회수]프랑스, 노란 플라스틱 이물 혼입 가능성으로 즉석섭취식품 3종 회수  -일자 : 2022.2.4-지역 : 프랑스 전역-브랜드 : La Cuisine du Poissonnier-제품명 : (*그라탱, 중량 : 800g, 로트번호 : 22005, 소비기한 : 25/01/2022, 26/01/2022, 27/01/2022, 28/01/2022, 냉장제품, 판매기간 : 13/01/2022~27/01/2022)1) Gratin de patates douces et cabillaud aux graines de courges (제품사진 ...",3,"[8] 독일 연방위해평가원, 유전자 편집 및 CRISPR/Cas9 관련 QnA 페이지 게재 독일 연방위해평가원(BfR)은 2022년 10월 27일 유전자 편집 및 CRISPR/Cas9 관련 질문 및 답변(QnA) 페이지를 게재하였음.  유전자 편집(Genome Editing)은 세포의 유전 물질(게놈)에 표적 개입을 허용하는 새로운 방법을 총칭하는 용어임.특히, CRISPR/Cas9의 응용 가능성은 이미 많은 다른 자료들에 서술되어 있음. BfR은 소비자의 건강 보호 관점에서 유전자 편집 기술의 개발을 과학적으로 지원(begleiten)함...",2,"[9] 호주뉴질랜드 식품기준청, 시금치 제품 회수에 관한 자주 묻는 질문 답변 * 관련 기수집 정보 :호주 뉴사우스웨일스주 보건부, 독성 반응 사례 발생으로 'Riviera Farms' 브랜드 시금치 섭취하지 말라고 권고(수집일자: 2022-12-16)[회수]호주 Riviera Fresh Pty Ltd, 안전하지 않은 식물성 원료 오염 가능성으로 시금치 회수(수집일자:2022-12-16)[회수]호주 Woolworths Group, 안전하지 않은 식물성 원료 오염 가능성으로 샐러드 2종 회수 (수집일자: 2022-12-16)[회수]호주 AL...",1,"[10] 독일 연방위해평가원, 에틸렌옥사이드 관련 QnA 게재 독일 연방위해평가원(BfR)은 식품 내 에틸렌옥사이드(Ethylenoxid) 및 2-클로로에탄올 잔류물로 인한 잠재적 건강위험과 관련하여 QnA를 게재하였음.질문 목록은 다음과 같으며, 그 중 내용 일부를 발췌하였음. ○ 에틸렌옥사이드란 무엇인가 ○ 2-클로로에탄올의 기원은 무엇이며, 에틸렌옥사이드 이외의 기원에서 검출될 수 있는가  ○ 에틸렌 옥사이드는 어디에 사용되는가 ○ 유럽​​연합에서 식품 생산 및 저장에 에틸렌옥사이드 사용이 금지된 이유는 무엇이며 그 의미는 무엇인가 ○...",0
1,"[회수]미국 La Nicosia Bakery Corp, 미표시된 알레르기 유발물질 대두 함유 가능성으로 빵류 회수",La Nicosia Bakery Corp에서 회수한 8 Pack Rolls의 유통 지역은 어디인가요?,(LLM 비활성화: 근거 문서만 제공),미국 뉴욕주 브롱크스(Bronx) 소매점,True,1,9,"[1] [회수]미국 La Nicosia Bakery Corp, 미표시된 알레르기 유발물질 대두 함유 가능성으로 빵류 회수   -일자 : 2022.6.9. -유통지역 : 미국 뉴욕주 브롱크스(Bronx) 소매점 -제품명 : 8 Pack Rolls (UPC code : 83273-00033, 투명 비닐팩 포장, expiration date : 6/9/22) -회수사 : La Nicosia Bakery Corp-회수사유 : 미표시된 알레르기 유발물질 '대두' 함유 가능성 -제품사진 : --기타 : 해당 제품과 관련한 질병 및 알레르기 반응은 보...",9,"[2] [E/R]미국 Mai's Bakery, Corp, 알레르기 유발성분 미표시로 빵류 회수 -지역: 미국 Los Angeles, CA 소재 유통업체에 유통하였고 Arizona, California, Denver, Michigan, Nebraska, Arizona 지역으로 추가 유통되었음.-회수사: Mai's Bakery, Corp (회수중, 회수일: 5/18/2022)-제품명: 1) Mia's Bakery Black Sesame Mochi Wt. 7 oz./198.5 gram UPC: 8 50660 00009 0. (6-01; 6-02...",8,"[3] 중국  상하이해관수출입안전처, 수입식품에 관한 문답(국가표준체계편) 상하이해관 수출입식품안전처(上海海关进出口食品安全处)는 수입식품에 관한 문답(국가표준체계편)을 제공함.Q1. 중국 식품안전표준은 어떠한 내용을 포괄하고 있는가?-중국 식품안전 국가표준의 내용은 8개 부분을 포함하고 있음1) 식품, 식품첨가물, 식품 관련 제품 중 병원성 미생물, 농약잔류, 동물용의약품잔류, 생물독소, 중금속 등 오염물질 및 기타 인체건강 위해물질의 제한량 규정2) 식품첨가물의 품목, 사용범위, 사용량3) 영유아 및 기타 특정집단 전용 주보조식품의 영양...",7,"[4] 벨기에 연방식품안전청, Ferrero(사) 초콜릿 관련 살모넬라증 감염에 관한 FAQ 게재  ​벨기에 연방식품안전청(이하 AFSCA)는 Ferrero(사) 초콜릿 관련 살모넬라증 감염에 관한 FAQ(*)를 게재함  1. 살모넬라증은 무엇인가?살모넬라증은 살모넬라균 또는 살모넬라균에 의한 식품 오염임. 다양한 종류의 살모넬라균이 있으며, 이러한 살모넬라균은 주로 사람의 소화관을 감염시키고 위장염을 유발함. 살모넬라증은 대부분 치료 없이 해결되나, 취약하거나 쇠약해진 사람들의 경우 살모넬라증이 심각한 형태로 발전할 수 있음. 증상이 심...",6,"[5] 중국 외교부 대변인,  NHK 기자의 대만의 일본 후쿠시마 일대 식품 수입허용에 관한 Q&A  (질의)NHK 기자 : 일본 후쿠시마 원전사고 이후 지속된 일본 식품 수입제한 문제에 관해 작년 싱가포르, 미국 등 국가가 수입제한 해제를 발표한 뒤, 오늘(2월 8일) 대만 또한 수입제한 해제를 발표했음. 중국은 일본 식품 수입제한에 대해 어떠한 입장인가? 또한 대만의 제한 완화에 대해 어떠한 입장인가 (답변) 외교부 대변인 자오리젠(赵立坚): 2011년 3월 후쿠시마 원전 사고 후, 방사능에 오염된 식품의 중국으로의 수입을 막기 위해 ...",5,"[6] 미국  상원의원, 식품의약품청에 식품안전영양센터의 지연 및 부작위에 대한 즉각적인 조치 및 답변을 요구하는 서한 발송 미국 상원보건교육노동연금(HELP)위원회 의장인 Patty Murray 상원의원은 가족의 건강과 안전을 위험에 빠뜨리는 미국 식품의약품청(FDA) 식품안전영양센터의 지연 및 부작위 문화를 드러낸 Politico의 보고서에 대한 답변과 즉각적인 조치를 촉구하는 서한을 미국 식품의약품청(FDA) 청장 Robert M. Califf에 발송했음. Patty Murray 의원은 서한을 통해 다음에 대한 답변을 2022년 4월...",4,"[7] [회수]미국 Prairie City Bakery, 살모넬라 오염 가능성으로 땅콩버터 함유 제품 회수 -일자: 2022.06.08. (FDA 발표일: 2022.06.08.)-유통지역: 미국 전역-회수사: Prairie City Bakery-브랜드명: Prairie City Bakery-제품명: Prairie City Bakery® Peanut Butter Chocolate Chip Ooey Gooey Butter Cake. 2 온스. Ten Pack UPC: 7-97884-36719-9. Individual Unit UPC: 7-97...",3,"[8] 미국 식품의약품청, 한눈에 보는 '식품분석용 검사실 승인(LAAF)에 관한 최종규칙' 게시 *기수집정보: 미국 식품의약품청, 식품 분석용 검사실 인증 프로그램 수립에 대한 최종규칙 발표(수집일자: 2021-12-02)  미국 식품의약품청(FDA)은 '식품분석용 검사실 승인과 관련된 식품안전현대화법(FSMA) 최종규칙'에 대해 '한눈에 알아보는 자료표(*)'를 게시함. 최종규칙은 특정 상황에서 식품을 검사하기 위한 실험실 승인 프로그램을 수립함. 동 자료표에는 다음과 같은 내용이 들어있음.- 동 최종규칙의 영향을 받는 사람은 누구인가...",2,"[9] 베트남 Matxi Corp, ‘Max Health Go Coffee’ 식품안전위생 품질 충족 확인  *기수집정보(22-05-26): 베트남 식품안전국, 시부트라민이 함유된 MAX HEALTH GO COFFEE CA PHE INSERT COFFEE TO BEGIN 제품 경고 베트남 보건부 산하 식품안전국은 5월 6일 호찌민시 공중보건연구원의 식중독 의심 관련 공문을 받았음. 6월 14일 검사단(팀)을 구성하여 Matxi Corp 회사 및 공장 내 ‘MAX HEALTH GO COFFEE’ 제품 샘플검사를 실시한 결과,  금지 물질인 시...",1,"[10] [회수]미국 Molson Coors, 업체의 품질기준 미충족으로 주류 제품 자진 철수 -일자: 2022.06.14.-유통지역: 미국(*상세 지역은 언급되지 않음)-회수사: Molson Coors-제품명: 1) Coors Light 12 Pack 12 온스 캔(UPC: 00-71990-00048) 2) Coors Light 18 Pack 12 온스 캔(UPC: 00-71990-30017)3) Coors Light 24 Pack 12 온스 캔(UPC: 00-71990-31600)4) Coors Light 30 Pack 12 온스 캔(U...",0
2,"[E/R]미국 MOOR HERBS, 기준규격 부적합으로 영유아조제식 회수",Moor Herbs Healthy Beauty Angel Formula 제품의 회수 이유는 무엇인가요?,(LLM 비활성화: 근거 문서만 제공),"영유아조제식이라고 판매되었으나, 시판 전 FDA에 통지하지 않았고, 철분, 칼륨 및 나트륨이 최대허용범위를 초과하여 철분과다 및/또는 전해질불균형을 초래할 수 있으며, 비타민 D가 존재하지 않기 때문입니다.",True,2,8,"[1] [회수]미국 Moor Herbs, 영아용 분유 기준규격 부적합으로 분유 회수 -일자: 2022.1.7(FDA 발표일: 2022.1.7)-유통지역: 미국 전역-회수사: Moor Herbs-브랜드명: Moor Herbs-제품명: Angel Formula(16 fl. Oz.; UPC 또는 로트 코드 없음; 2019년 2월 이후 배송 및 유통중인 제품)-회수사유: 영아용 분유 기준규격 부적합(철분, 나트륨, 칼륨 기준치 초과 및 비타민D 미함유)-제품사진: 원문참조-기타: 본 회수는 FDA의 요청에 의해 시작되었으며, 동 제품과 관련하여 ...",9,"[2] [E/R]미국 MOOR HERBS, 기준규격 부적합으로 영유아조제식 회수 -지역: 인터넷 판매를 통해 유통되었으며, 업체의 매장에서 판매되었음.(*상세 지역은 언급되지 않음)-제품명: Moor Herbs Healthy Beauty Angel Formula. 16oz. 로트코드 정보 없음.-회수사: MOOR HERBS (회수중, 회수일: 12/23/2021)-회수사유: 영유아조제식(infant formula)이라고 판매되었으나, 시판 전 FDA에 통지하지 않음. 또한 FDA의 검사 결과, 철분, 칼륨 및 나트륨이 최대허용범위를 초과했...",8,"[3] 중국  상하이해관수출입안전처, 수입식품에 관한 문답(국가표준체계편) 상하이해관 수출입식품안전처(上海海关进出口食品安全处)는 수입식품에 관한 문답(국가표준체계편)을 제공함.Q1. 중국 식품안전표준은 어떠한 내용을 포괄하고 있는가?-중국 식품안전 국가표준의 내용은 8개 부분을 포함하고 있음1) 식품, 식품첨가물, 식품 관련 제품 중 병원성 미생물, 농약잔류, 동물용의약품잔류, 생물독소, 중금속 등 오염물질 및 기타 인체건강 위해물질의 제한량 규정2) 식품첨가물의 품목, 사용범위, 사용량3) 영유아 및 기타 특정집단 전용 주보조식품의 영양...",7,"[4] 벨기에 연방식품안전청, Ferrero(사) 초콜릿 관련 살모넬라증 감염에 관한 FAQ 게재  ​벨기에 연방식품안전청(이하 AFSCA)는 Ferrero(사) 초콜릿 관련 살모넬라증 감염에 관한 FAQ(*)를 게재함  1. 살모넬라증은 무엇인가?살모넬라증은 살모넬라균 또는 살모넬라균에 의한 식품 오염임. 다양한 종류의 살모넬라균이 있으며, 이러한 살모넬라균은 주로 사람의 소화관을 감염시키고 위장염을 유발함. 살모넬라증은 대부분 치료 없이 해결되나, 취약하거나 쇠약해진 사람들의 경우 살모넬라증이 심각한 형태로 발전할 수 있음. 증상이 심...",6,"[5] 미국  상원의원, 식품의약품청에 식품안전영양센터의 지연 및 부작위에 대한 즉각적인 조치 및 답변을 요구하는 서한 발송 미국 상원보건교육노동연금(HELP)위원회 의장인 Patty Murray 상원의원은 가족의 건강과 안전을 위험에 빠뜨리는 미국 식품의약품청(FDA) 식품안전영양센터의 지연 및 부작위 문화를 드러낸 Politico의 보고서에 대한 답변과 즉각적인 조치를 촉구하는 서한을 미국 식품의약품청(FDA) 청장 Robert M. Califf에 발송했음. Patty Murray 의원은 서한을 통해 다음에 대한 답변을 2022년 4월...",5,"[6] 독일 연방위해평가원, 에틸렌옥사이드 관련 QnA 게재 독일 연방위해평가원(BfR)은 식품 내 에틸렌옥사이드(Ethylenoxid) 및 2-클로로에탄올 잔류물로 인한 잠재적 건강위험과 관련하여 QnA를 게재하였음.질문 목록은 다음과 같으며, 그 중 내용 일부를 발췌하였음. ○ 에틸렌옥사이드란 무엇인가 ○ 2-클로로에탄올의 기원은 무엇이며, 에틸렌옥사이드 이외의 기원에서 검출될 수 있는가  ○ 에틸렌 옥사이드는 어디에 사용되는가 ○ 유럽​​연합에서 식품 생산 및 저장에 에틸렌옥사이드 사용이 금지된 이유는 무엇이며 그 의미는 무엇인가 ○...",4,"[7] 미국 식품의약품청, 한눈에 보는 '식품분석용 검사실 승인(LAAF)에 관한 최종규칙' 게시 *기수집정보: 미국 식품의약품청, 식품 분석용 검사실 인증 프로그램 수립에 대한 최종규칙 발표(수집일자: 2021-12-02)  미국 식품의약품청(FDA)은 '식품분석용 검사실 승인과 관련된 식품안전현대화법(FSMA) 최종규칙'에 대해 '한눈에 알아보는 자료표(*)'를 게시함. 최종규칙은 특정 상황에서 식품을 검사하기 위한 실험실 승인 프로그램을 수립함. 동 자료표에는 다음과 같은 내용이 들어있음.- 동 최종규칙의 영향을 받는 사람은 누구인가...",3,"[8] 스위스 연방평의회, 국민의회 심의요청 20.3913 이행 관련 뉴트리스코어 효과 개선 보고서 발표 스위스 연방평의회(Bundesrat, 또는 행정부)는 스위스 국민의회(Nationalrat, 또는 하원) 안전보건위원회(SGK-NR) 심의요청 20.3913 이행 관련 뉴트리스코어(Nutri-Score) 효과 개선 보고서를 2022년 12월 2일 발표하였음.  2020년 6월 26일 국민의회 안전보건위원회 심의요청은 다음과 같았으며, 연방평의회는 보고서에서 이에 대한 분석 내용을 게재하였음:1. 뉴트리스코어가 '마켓 바스켓(market...",2,"[9] 독일 연방위해평가원, 유전자 편집 및 CRISPR/Cas9 관련 QnA 페이지 게재 독일 연방위해평가원(BfR)은 2022년 10월 27일 유전자 편집 및 CRISPR/Cas9 관련 질문 및 답변(QnA) 페이지를 게재하였음.  유전자 편집(Genome Editing)은 세포의 유전 물질(게놈)에 표적 개입을 허용하는 새로운 방법을 총칭하는 용어임.특히, CRISPR/Cas9의 응용 가능성은 이미 많은 다른 자료들에 서술되어 있음. BfR은 소비자의 건강 보호 관점에서 유전자 편집 기술의 개발을 과학적으로 지원(begleiten)함...",1,"[10] 프랑스 정부, 뉴트리스코어에 대한 5문 5답 *관련 기수집 정보 : 벨기에 등 유럽 7개국, 뉴트리스코어 알고리즘 개발 채택(수집일자 : 2022-08-01)  2017년에 프랑스에서 개발한 영양표시제인 뉴트리스코어(Nutri-Score)(*)는 현재 프랑스와 더불어 벨기에, 독일, 룩셈부르크, 네덜란드, 스페인, 스위스에서 사용중임. 2022년 7월 26일, 해당 국가들로 구성된 초국경 거버넌스는 뉴트리스코어 알고리즘 업데이트를 채택했음. 이를 계기로 프랑스 정부는 다음과 같이 문답 형식을 통해 뉴트리스코어에 대해 안내했음.  (...",0
