id,제목,질문,예상답변,정답,target_found,target_rank,target_score,문서1,점수1,문서2,점수2,문서3,점수3,문서4,점수4,문서5,점수5,문서6,점수6,문서7,점수7,문서8,점수8,문서9,점수9,문서10,점수10
0,"유럽질병예방통제센터, 2018년 편모충증 연례 역학보고서 게재",2018년 유럽연합/유럽경제지역에서 편모충증의 통보율은 어느 연령대에서 가장 높았나요?,(LLM 비활성화: 근거 문서만 제공),0~4세 연령에서 가장 높은 통보율이 관찰되었음.,True,1,0.6003804802894592,"[1] 유럽질병예방통제센터, 2018년 편모충증 연례 역학보고서 게재 유럽질병예방통제센터(ECDC)는 2018년의 편모충증(Giardiasis) 연례 역학보고서(*)를 게재하였음. ― 2018년 유럽연합/유럽경제지역(EU/EEA)에서 21,049건의 편모충증 확진 사례가 보고되었으며, 통보율은 인구 10만 명 당 5.6건이었음. ― 벨기에, 불가리아, 스웨덴에서 가장 높은 통보율이 보고되었으며, 인구 10만 명 당 가장 높은 통보율은 0~4세 연령에서 관찰되었음(남성 17.2, 여성 14.4).― 2014년부터 2018년까지 EU/EEA의...",0.6003804802894592,"[2] 유럽질병예방통제센터, 2020년 크립토스포리디움증 연례역학보고서 게재 유럽질병예방통제센터(ECDC)는 2024년 12월 3일 크립토스포리디움증(Cryptosporidiosis)에 대한 2020년 연례역학보고서(*)를 게재함. - 2020년 유럽연합/유럽경제지역(EU/EEA)의 24개국이 4,164건의 크립토스포리디움증을 보고함. - 통보율(notification rate)은 인구 10만 명 당 1.7건으로 지난 5년 동안 가장 낮은 수치임이며, 이는 COVID-19 및 브렉시트로 인해 2020년부터 영국의 보고가 중단된 것에 기인함...",0.5508062839508057,"[3] 유럽질병예방통제센터, 2019년 캠필로박터증 연례역학보고서 게재 유럽질병예방통제센터(ECDC)는 2024년 4월 3일 캠필로박터증(Cryptosporidiosis)에 대한 2019년 연례역학보고서(*)를 게재함.  2005년 이후 캠필로박터는 유럽연합/유럽경제지역(EU/EEA) 내 인간에게서 가장 빈번히 보고된 소화계(gastrointestinal) 박테리아 병원균이며, 동 보고서는 2019년까지의 사례를 종합함. 2008년에서 2018년까지의 기간 동안 인체 캠필로박터증 유형은 크게 증가해왔으나, EU/EEA 내 유행은 2019년...",0.5311663150787354,"[4] 유럽질병예방통제센터, 2018 및 2020년 캠필로박터증 연례역학보고서 게재 유럽질병예방통제센터(ECDC)는 2024년 5월 2일 캠필로박터증(Campylobacteriosis)에 대한 2018 및 2020년 연례역학보고서(*)를 게재함.  ▲ 2020년 연례역학보고서 ( https://www.ecdc.europa.eu/en/publications-data/campylobacteriosis-annual-epidemiological-report-2020 )2020년 29개 유럽연합/유럽경제지역(EU/EEA) 국가에서 123,062건의...",0.5293996334075928,"[5] 유럽질병예방통제센터, 2022년 브루셀라증 연례역학보고서 게재 유럽질병예방통제센터(ECDC)는 2024년 4월 26일 브루셀라증(Brucellosis)에 대한 2022년 연례역학보고서(*)를 게재함.  - 2022년 유럽연합/유럽경제지역(EU/EEA) 내 199건의 브루셀라증이 보고되었으며, 발병률은 인구 10만 명 당 0.04 건임. 이전 년도와 같이 가장 높은 발병률을 기록한 국가는 그리스로, 인구 10만 명 당 0.33건을 기록하였음. - 2020년 COVID-19 등으로 인해 발병률이 급격히 감소한 이후 2021-2022년 ...",0.5273820757865906,"[6] 유럽질병예방통제센터, 2022년 선모충증 연례 역학보고서 게재 유럽질병예방통제센터(ECDC)는 2022년의 선모충증(Trichinellosis) 연례 역학보고서(*)를 게재하였음. ― 2022년 28개의 유럽연합/유럽경제지역(EU/EEA) 국가에서 총 39건의 선모충증이 보고되었으며, 이는 2021년에 비해 49% 감소한 수치임. 인구 10만 명 당 통보율은 0.01건임. ― 2022년, 라트비아와 불가리아가 인구 10만 명 당 각각 0.16 및 0.13 건으로 EU/EEA 내 가장 높은 통보율을 보였음.― 통제되지 않은(밀폐되지 ...",0.5259833335876465,"[7] 유럽질병예방통제센터, 2022년 보툴리즘 연례역학보고서 게재 유럽질병예방통제센터(ECDC)는 2024년 7월 10일 보툴리즘(Botulism)에 대한 2022년 연례역학보고서(*)를 게재함.  - 2022년 유럽연합/유럽경제지역(EU/EEA) 내 84건의 보툴리즘이 보고되었으며, 30개의 보고 대상 회원국 중 17개국에서는 보고되지 않았음. 발병률은 인구 10만 명 당 0.02 건임.- 가장 높은 발병률을 기록한 국가는 몰타로, 인구 10만 명 당 0.34건을 보였으며, 루마니아(10만 명 당 0.08건), 이탈리아(10만 명 당 ...",0.5150485634803772,"[8] 유럽질병예방통제센터, 2019년 및 2021년 크립토스포리듐증 연례역학보고서 게재 유럽질병예방통제센터(ECDC)는 2024년 2월 13일 인수공통전염병 크립토스포리듐증(Cryptosporidiosis)에 대한 2019년 및 2021년 연례역학보고서를 게재함.  (2019) 유럽/유럽경제지역(EU/EEA) 내 25개국에서 11,126건의 크립토스포리듐증이 보고되었음.― URL: https://www.ecdc.europa.eu/en/publications-data/cryptosporidiosis-annual-epidemiological...",0.5116060376167297,"[9] 유럽식품안전청, 유럽연합 원헬스 2023년 인수공통전염병 보고서 발표... 리스테리아증은 2007년 이후 최고치 기록 유럽식품안전청(EFSA)은 2024년 10월 10일, 유럽질병예방통제센터(ECDC)와 함께 '유럽연합 원헬스 2023년 인수공통전염병 보고서(The European Union One Health 2023 Zoonoses report)'를 발표함. 2023년 리스테리아증 발병 건수는 2007년 이후 최고치를 기록했으며, 캠필로박터증과 살모넬라증은 유럽연합(EU)에서 가장 빈번히 보고되는 인수공통전염 질병 지위를 유지하...",0.4685104489326477,"[10] 핀란드, 여시니아균 감염 사례 증가해 핀란드의 공중 보건 당국에 따르면, 2024년 1월부터 현재까지 여시니아 감염증 사례가 증가함. 전염병 등록부에 보고된 여시니아균(Yersinia enterocolitica) 감염 사례는 168건임. 참고로 2023년 1~4월간 64건 발생했음. 핀란드 보건복지연구소(THL)는 4월에 2건의 발병 의심 경보를 받았으며, Pirkanmaa, Uusimaa, Ostrobothnia 지역에서 여시니아균 감염증이 증가했다는 보고를 받았다고 설명했음. 2021년부터 2022년까지는 여시니아균 감염으로 인...",0.4534040689468384
1,"싱가포르 식품청 등 연구진, 싱가포르에서 가장 많이 발생한 식중독 원인은 클로스트리디움 퍼프린젠스",싱가포르에서 2018년부터 2021년까지 식중독의 주요 원인은 무엇인가?,(LLM 비활성화: 근거 문서만 제공),클로스트리듐 퍼프린젠스와 살모넬라균이 주요 원인이다.,True,1,0.6074154376983643,"[1] 싱가포르 식품청 등 연구진, 싱가포르에서 가장 많이 발생한 식중독 원인은 클로스트리디움 퍼프린젠스 싱가포르 식품청, 보건부 등의 연구에 따르면, 2018년부터 2021년까지 싱가포르에서 발생한 식중독의 가장 큰 원인 병원체는 클로스트리듐 퍼프린젠스와 살모넬라균이였음. 2018년 1월부터 2021년 12월까지 7,538건의 사례와 관련된 총 171건의 발병에 대해 조사하였음.  121건의 식중독 발병 중 42% 이상이 케이터링 업체(caterers)에서 조리한 음식에서 발생했고, 12.4%는 구내 식당(in-house kitchen)...",0.6074154376983643,"[2] 핀란드, 2020년-2022년 사이 식중독 135건 발병해... 최다 사유는 노로바이러스 미국 언론 Food Safety News에 따르면, 핀란드 식품청(Ruokavirasto) 및 보건복지연구소(THL)가 발표한 보고서(*)에 따르면, 지난 2020년에서 2022년 사이 총 135건의 식중독이 발병하였으며, 2,543명이 증상을 호소하고 86명이 입원했으며 15명이 사망하였음. 식중독 발생 최다 원인은 노로바이러스였으며, 살모넬라가 그 뒤를 이었음.  (*) https://www.ruokavirasto.fi/globalasset...",0.5372769832611084,"[3] 덴마크 보건당국, 2023년 식중독 발병 주 원인은 살모넬라 미국 언론 Food Safety News에 따르면, 덴마크 수의식품청 등의 보건 당국 데이터 분석 결과 덴마크 내 살모넬라 발병은 2022년 11건에서 2023년 18건으로 증가하였으며, 노로바이러스는 2022년 14건 대비 2023년 13건이 발생하여, 식중독 발병 주 원인은 살모넬라인 것으로 확인되었음. 한편, 지난 2023년 총 64건의 식품매개 발병과 1,760명의 환자가 보고되었음....",0.5059438347816467,"[4] 프랑스 공중보건청, 2022년 집단 식중독 발생 현황 발표  프랑스 공중보건청(SPF, Santé publique France)은 2022년 프랑스 내 집단 식중독 발생 현황을 발표했음. 2020년과 2021년에는 COVID-19로 인한 거리두기 조치 시행 등으로 식중독이 적게 발생했으나, 2022년에는 1987년 이래 가장 많이 발생했음.  특히 외식업체와 관련된 식중독 발생 비율이 2021년 35%에서 45%로 증가했으며, 가족 간 식사에서 발생한 식중독은 동 기간 33%에서 25%로 감소했음. 식중독의 42%는 살모넬라균 감염...",0.501915693283081,"[5] [연구결과]스웨덴 연구진 등, 스웨덴의 2018-2022년 크립토스포리듐증 감시 프로그램 분석결과 게재 미국 Food Safety News 언론에 따르면, 스웨덴 등의 연구진은 2018년부터 2022년 사이 진행된 스웨덴의 크립토스포리듐증(Cryptosporidium) 감시 프로그램을 분석한 결과 이 기간 동안 총 3,684건의 크립토스포리듐증이 보고되었으며 수십 건의 집단 발병이 확인되었다고 밝혔음. 주 원인은 식품매개감염이었으며, 2019년 저온 미살균 주스의 오염으로 122명의 환자가, 2022년 상추(frisée) 샐러드로 ...",0.49498531222343445,"[6] 싱가포르 식품청, 싱가포르 식품 통계 2023 발표 2024년 5월 20일, 싱가포르 식품청(SFA)은 지난 3년간 싱가포르의 식품 공급 및 식품 안전 데이터에 대한 연간 발간물인 ""싱가포르 식품 통계(SgFS) 2023""를 발표함. [2021-2023년의 주요 안건]◎ 수입원 다양화싱가포르는 식품의 90% 이상을 수입하므로, 질병 발생, 외국 정부의 정책 결정, 지정학적(geopolitical) 긴장으로 인한 글로벌 식품 공급망 중단에 취약함. 이러한 혼란의 영향을 최소화하기 위해 SFA는 관련 기관 및 업체와 긴밀히 협력하여 수...",0.4755445718765259,"[7] 뉴질랜드 일차산업부, 2023년 뉴질랜드 식중독 관련 연간 보고서 공개 뉴질랜드 일차산업부 식품안전국(New Zealand Food Safety)은 오늘 발표된 새로운 보고서에 따르면 뉴질랜드에서 가장 흔한 식중독인 캠필로박터증의 감염률을 낮추려는 목표에 가까워지고 있다고 함. 캠필로박터에 의한 뉴질랜드 식중독 감염률은 지난 4년간 10만 명당 88건에서 77건으로 감소하였음. 뉴질랜드 식품안전국장 빈센트 알버클은 ""뉴질랜드 식품 안전은 캠필로박터증 감염률을 줄이는 것을 주요 우선순위로 삼았으며, 최근 몇 년간 큰 진전이 있었다""고...",0.4668565094470978,"[8] 중국 식품화반넷, 2023년 중국 통관 거부 부적합 식품 현황 분석  2023년 1월 ~ 2024년 1월까지, 해관총서는 각 지역 해관에서 적발된 통관 거부 수입식품 정보(총 12회)를 발표함. 총 합계는 2,358배치이며 28대 식품유형과 관련됨. 주로 수산 및 그 제품, 음료, 육류 및 육제품, 베이킹 식품이고, 주요 부적합 항목은 제품 라벨표시 비규범, 서류 미비 및 화물증서 미부합임.  다음은 부적합 식품유형, 부적합 원인요소, 항구, 원산지에 대한 분석임.▶(식품유형) 통관 거부된 부적합 식품은 수산 및 그 제품(521배치...",0.4666319191455841,"[9] 인도 식품안전기준청, 2024년~2025년 향신료, 허브, 쌀, 과일, 채소 등에 대한 인도 전역의 감시 계획 예정 홍콩과 싱가포르가 일부 인도 향신료 브랜드를 금지한 후, 월요일 인도 식품안전기준청(FSSAI)은 과일과 채소를 포함한 4가지 종류의 식품과 함께 향신료와 요리용 허브를 검사할 것이라고 함. FSSAI는 지난해 검사한 샘플 중 25% 이상이 규제 기준을 준수하지 못했다고 밝힘. 2022~2023년 1,77,511개 이상의 샘플이 수집되었으며, 이 중 44,626개(25.14%)는 미준수로 확인되었음. 에틸렌옥사이드 검...",0.4640533924102783,"[10] 대만, 환경 변화로 성인의 식품 알레르기 유병률 높아져 Linkou Chang Gung Memorial Hospital(林口長庚醫院)이 2017년 성인, 초중생 등 10,000명을 대상으로 진행한 설문 조사 결과에 따르면, 4~18세 아동의 알레르기 유병률은 2004년 7.7%에서 2017년 10.4%로 증가했고, 19세 이상 성인은 6.4%에서 12.5%로 두배 급증한 것으로 나타남. 알레르기를 일으키는 유발물질로는 초중생, 성인 모두 갑각류 해산물이 1위를 차지함. 쑤관원(蘇冠文) 소아과 주임은 과거에는 외국에서 태어난 대만 아...",0.46108925342559814
2,"[회수]뉴질랜드 International Foods Ltd, 살모넬라 오염 가능성으로 인도산 참깨 회수",Scrumptious brand Sesame Seeds의 회수 사유는 무엇인가요?,(LLM 비활성화: 근거 문서만 제공),살모넬라 오염 가능성,False,,,"[1] [E/R]미국 Samsung Bean Sprout, 리스테리아 오염으로 콩나물 회수 -지역: 미국 Virgnia-제품명: Sam Sung Soy Bean Sprouts, Net Wt. 1LB. 유통기한(Sell By date): December 21, 2023-회수사: Samsung Bean Sprout (회수종료, 회수일: 12/29/2023)-회수사유: 리스테리아 모노사이토제네스...",0.5110757350921631,"[2] [회수]싱가포르 Smoof Pte Ltd, 미표시된 알레르기 유발물질 우유 함유로 브라질산 소르베 회수 - 회수일자: 2024년 11얼 19일- 제품명: Smoof Acai Sorbet Pure- 품질유지기한(Best Before date): 15/7/2025- 원산지: 브라질- 수입사: Smoof Pte Ltd- 회수사유: 식품 패키지 라벨에 알레르기 유발물질 우유 미표시- 제품사진: 원문참조...",0.49433279037475586,"[3] [회수]뉴질랜드 Centamax Dairy Limited, 살모넬라 존재 가능성으로 인도산 참깨 회수 -일자: 2024-07-20-유통지역: 뉴질랜드 18 Gravatt Road, Papamoa 소재 Papamoa Spice King. 재수출되지 않음-회수사: Centamax Dairy Limited-브랜드명: Papamoa Spice King-제품명: Sesame Seeds White >벌크 통 판매>판매기간(Date marking): 27 June 2024~19 July 2024-원산지(수출국): 인도-회수사유: 살모넬라 존재 ...",0.47851911187171936,"[4] [회수]남아프리카 공화국 Shoprite, 미생물 오염으로 후무스 제품 5종 회수 - 일자: 2024.9.17.- 지역: 남아프리카 공화국- 제품명: fresh Deli hummus (무게: 300g 및 125g; 일자(sell-by dats): 2024년 9월 10일부터 2024년 10월 8일 사이)> Hummus> Reduced Fat Hummus> Za’atar Hummus > Red Pepper Hummus > Caramelised Onion Hummus- 회수사: Shoprite- 판매업체: Checkers 슈퍼마켓 및 일...",0.4507495164871216,"[5] [E/R]미국 Samsung Bean Sprout, 리스테리아 검출로 콩나물 회수 -지역: 미국 VA-제품명: Sung Soy Bean Sprouts, 1lb packages, 케이스당 20 bags (Sell by date 12/14/23)-회수사: Samsung Bean Sprout (회수중, 회수일: 12/20/2023)-회수사유: 리스테리아 모노사이토제네스 검출...",0.4391055703163147,"[6] [회수]프랑스, 살모넬라 존재 가능성으로 Franprix 브랜드 씨앗 믹스 회수  -일자 : 2024. 3. 28.-판매지역 : 프랑스 전역-브랜드 : Franprix-제품명 : le mélange salade graines de courges, de tournesol, pignons (*호박씨/해바라기씨/잣 믹스 제품, 바코드 : 3263851480613, 로트번호 : 14009055, 품질유지기한 : 05/09/2024, 판매기간 : 11/01/2024~27/03/2024, 중량 : 125g/봉, 실온제품)-유통사 : Franp...",0.4363495707511902,"[7] [회수]미국 Schnuck Markets Inc., 살모넬라 오염 가능성으로 치즈 스프레드 회수 -일자: 2024-05-05-회수사: Schnuck Markets Inc. -제품명1)Schnucks Whip Cream Spread; UPC 4131858005; Best By: 8/8/20242)Schnucks Strawberry Spread; UPC 4131858007; Best By: 9/8/20243)Schnucks Cream Cheese Spread; UPC 4131858023; Best By: 10/8/2024-회수사유: 살...",0.43474119901657104,"[8] [회수]미국 Shemshad Food Products, 클로스트리디움 보툴리눔 오염으로 잼류 회수 - 일자: 2024.01.05.- 유통지역: 미국 Southern California- 회수사: Shemshad Food Products- 제품명: Mulberry Jam and Mulberry Molasses. 16-ounce glass jars. dated APR 25, 2025.- 회수사유: 클로스트리디움 보툴리눔 오염...",0.4245080351829529,"[9] [회수]싱가포르 Yan Tai Yit Pte Ltd, 사이클라메이트 존재로 중국산 땅콩 가공품 회수 -일자: 2024-12-12-제품명: YTY Garlic Peanuts(중량: 150g, 소비기한(Expiry date): 8/4/2025)-원산지: 중국-수입사: Yan Tai Yit Pte Ltd-회수사유: 사이클람산(Cyclamic Acid)으로서 사이클라메이트(Cyclamate) 존재-제품사진: 원문참조...",0.4239922761917114,"[10] [회수]뉴질랜드 My Food Bag, 살모넬라 오염 가능성으로 인도산 참깨 회수 -일자: 2024-07-19-유통지역: 뉴질랜드 My Food Bag(사)를 통해 판매됨. 재수출 되지 않음.-회수사: My Food Bag-제품명: White Sesame Seed (10g). 배치번호(Batch marking): AAI/3890. 종이 봉투에 판매됨.-원산지(수출국): 인도-회수사유: 살모넬라 오염 가능성-제품사진: 원문참조-기타: 동 문제와 관련된 부작용 사례 보고된 바 없음....",0.4200783669948578
3,"네덜란드 국립보건환경연구원, 식중독 발생 건수 전년 대비 증가...특히 살모넬라증 증가해",2023년 네덜란드에서 살모넬라증 발병 원인은 무엇인가?,(LLM 비활성화: 근거 문서만 제공),살모넬라증 2건의 발생 원인은 산란계 농장에서 생산된 계란과 충분히 숙성되지 않은 건조 소시지로 확인되었음.,False,,,"[1] 덴마크 보건당국, 2023년 식중독 발병 주 원인은 살모넬라 미국 언론 Food Safety News에 따르면, 덴마크 수의식품청 등의 보건 당국 데이터 분석 결과 덴마크 내 살모넬라 발병은 2022년 11건에서 2023년 18건으로 증가하였으며, 노로바이러스는 2022년 14건 대비 2023년 13건이 발생하여, 식중독 발병 주 원인은 살모넬라인 것으로 확인되었음. 한편, 지난 2023년 총 64건의 식품매개 발병과 1,760명의 환자가 보고되었음....",0.55504310131073,"[2] 독일 연방소비자보호식품안전청, 2023년 식품매개 질병 발병 보고서 발표... 가장 흔한 원인은 살모넬라 독일 연방소비자보호식품안전청(BVL)은 2024년 11월 4일, 2023년의 식품매개 질병 발병 보고서를 발표하였음. BVL과 로버트코흐연구소(RKI)는 2023년 총 190건의 발병을 확인하였음. 이로 인해 2,248명이 감염되었고, 283명이 입원하였으며, 13명이 사망함. 가장 흔한 발병원은 살모넬라였음. (*) 보고서 원문: https://www.bvl.bund.de/SharedDocs/Berichte/10_BELA_le...",0.5463947653770447,"[3] 오스트리아 보건식품안전청, 전년 대비 2023년 식품매개 발병 증가해... 주 원인은 살모넬라 미국 Food Safety News에 따르면, 오스트리아 보건식품안전청(AGES)은 2023년 식품매개 발병이 총 42건 발생해 전년도 21건 대비 증가했다고 밝혔으며, 영향을 받은 사람은 총 222명이었다고 밝혔음(*). 주 원인은 살모넬라로, 총 21건의 발병과 141명의 환자(1명 사망; 폴란드산 닭고기와 연관)에 영향을 미쳤음. 그 뒤로는 캠필로박터가 12건의 발병과 26명의 환자, 시가독소 생성 대장균(STEC)은 5건의 발병과 ...",0.5387922525405884,"[4] 뉴질랜드 일차산업부, 뉴질랜드 계란을 대상으로 살모넬라 위재평가를 한 결과 살모넬라 발병 위험도 낮아 뉴질랜드 일차산업부는 뉴질랜드 계란에서 살모넬라 엔테리티디스(Salmonella Enteritidis)가 발병할 위험은 여전히 낮다고 함. 뉴질랜드 닭의 알에 있는 살모넬라에 대한 최초 위험 프로필은 2004년에 발표되었고, 2011년과 2016년에 업데이트됨. 뉴질랜드에서 기른 가금류에 의한 인체 질병은 고려되지 않았음. 2023년 업데이트는 살모넬라 발병 이후 뉴질랜드에서 생산된 계란의 살모넬라 위험에 대한 잠재적 변화 조사를 ...",0.5077344179153442,"[5] 스웨덴 보건당국, 2023년 병원성 미생물 감염 통계 발표... 살모넬라 발병 등 미국 언론 Food Safety News에 따르면, 스웨덴 보건당국이 발표한 2023년 병원성 미생물 감염 통계 중 큰 규모의 살모넬라 발병 등이 확인되었음.  2023년 총 1,316건의 살모넬라 감염이 보고되었으며(비교: 2022년 1,137건), 이중 절반 이상이 태국, 튀르키예 등 해외에서 감염되었음. 10건 이상의 사례가 보고된 발병은 총 3건으로, 그중 1건은 82명의 사람들에게 영향을 미쳤고 스웨덴의 가장 큰 양계 시설인 CA Cederg...",0.503876805305481,"[6] 세계보건기구, 2023년 전 세계 조류인플루엔자 발생에 관하여 세계보건기구(WHO)는 2023년에 발생한 조류인플루엔자와 관련하여, 인수공통전염병의 현실, 모든 연령대가 취약할 수 있다는 점, 동반질병과 무관하게 위험할 수 있으며, 다양한 노출이 조류인플루엔자 감염으로 이어질 수 있다는 사실을 보여준다고 함. 2023년 인체 감염을 일으켰던 인수공통전염병 바이러스의 다양성은 경각심을 일깨우고 있으며, 일부 유형의 인수공통전염병 바이러스 감염은 높은 사망률로 심각한 질병을 일으켰음. WHO는 동물과 인간 모두에 대해 협력기관들과의 공...",0.501515805721283,"[7] 유럽질병예방통제센터, 2021년 이후 EU/EEA 내 300건의 살모넬라 음반다카 발병 보고돼 * 관련 기수집 정보: 유럽식품안전청, EU/EEA 및 UK 내 닭고기 제품 섭취와 연관된 살모넬라 음반다카 ST413 다국가 발병 보고서 업데이트 (수집일자: 2024-03-22) 유럽질병예방통제센터(ECDC)는 유럽식품안전청(EFSA)과 공동 작성한 신속발병평가 보고서 업데이트를 통해 2021년 이후 2년이 넘는 기간 동안 유럽연합/유럽경제지역(EU/EEA) 및 영국(UK) 내 살모넬라 음반다카 ST413의 다국가 발병이 지속되고 있다...",0.4954484701156616,"[8] 독일 연방위해평가원, EU 살모넬라 퇴치프로그램 관련 2023년 결과 보고서 게재 독일 연방위해평가원(BfR)은 EU의 살모넬라 퇴치프로그램과 관련하여 2023년 결과 보고서를 게재하였음. 동 보고서는 육종 가금류, 산란계, 육계 및 육종/육성 칠면조 중 살모넬라 양성 비율을 공개함.  2023년 데이터 평가 결과, 살모넬라 발병률은 전년도와 유사하게 낮은 수준을 보였음. 살모넬라 유형(혈청형)과 관련하여 검사된 모든 가금류에서 퇴치 목표인 '살모넬라 양성 비율 최대 1% 또는 2%(산란계)'가 달성되었음....",0.49478086829185486,"[9] 네덜란드 국립공중보건환경연구소, 2023년 식품매개 감염 보고서 발표... 감염 건수 수년 만에 처음 감소해 네덜란드 국립궁중보건환경연구소(RIVM)은 2023년 식품매개 감염 보고서를 발표하였으며, 2023년 총 911건의 발병(비교: 2022년 1,173건)을 기록해 2020년 코로나 발병 첫해를 제외하고 2016년 이후 처음으로 감소했다고 밝혔음. 또한 영향을 받은 환자의 수는 2022년 4,505명에서 2023년 3,500명으로 감소했다고 설명함.  어떤 식품 제품이 오염되고 어떤 병원균이 증상을 일으키는지 명확히 알려지지 ...",0.49209484457969666,"[10] 핀란드, 2020년-2022년 사이 식중독 135건 발병해... 최다 사유는 노로바이러스 미국 언론 Food Safety News에 따르면, 핀란드 식품청(Ruokavirasto) 및 보건복지연구소(THL)가 발표한 보고서(*)에 따르면, 지난 2020년에서 2022년 사이 총 135건의 식중독이 발병하였으며, 2,543명이 증상을 호소하고 86명이 입원했으며 15명이 사망하였음. 식중독 발생 최다 원인은 노로바이러스였으며, 살모넬라가 그 뒤를 이었음.  (*) https://www.ruokavirasto.fi/globalasset...",0.47315022349357605
