id,제목,질문,예상답변,정답,target_found,target_rank,target_score,문서1,점수1,문서2,점수2,문서3,점수3,문서4,점수4,문서5,점수5,문서6,점수6,문서7,점수7,문서8,점수8,문서9,점수9,문서10,점수10
0,"영국 웨일즈농민연합, EU 육류 제품 원산지 표시 결의안 환영",웨일즈농민연합은 육류 원산지 표시 결의안 통과를 위해 어떤 정부에 압력을 가할 것을 요청했나요?,(LLM 비활성화: 근거 문서만 제공),카디프와 웨스트민스터 지역 정부에 압력을 가할 것을 요청했습니다.,True,1,2.626542520523071,"[1] 영국 웨일즈농민연합, EU 육류 제품 원산지 표시 결의안 환영 영국 웨일즈농민연합(NFU Cymru) 가축위원회 의장 린든 에드워즈(Lyndon Edwards)는 EU 의회의 육류 제품 원산지 표시 결의안을 환영한다고 밝힘. 유럽에서 도축된 육류의 30~50%가 가공식품 재료로 사용되는 것으로 추정되기 때문에 육류 원산지 표시가 필수적임. 웨일즈 농민연합은 해당 결의안이 EU 의회에서 통과될 수 있도록 유럽 위원회에 압력을 가할 것을 카디프(Cardiff)와 웨스트민스터(Westminster) 지역 정부에 요청함....",2.626542520523071,"[2] 캐나다 총리, 미국의 원산지표시제 논란에 정치압력 가해 저스틴 트뤼도 캐나다 총리는 미 의회가 캐나다산 육류 수출품에 대한 표시법을 폐지하지 않을 경우, 관세보복을 감행할 준비를 하고 있다고 밝힘. 총리는 미국 정부가 움직이지 않는다면 과거 보수정권이 수립한 10억달러 가량의 제재조치 계획에 전념할 것이라고 전했음. 수년간 지속된 이 논쟁은 마침내 중대한 시기에 이르게 되었는데, 이는 수일 내에 해결될 수도, 캐나다와 멕시코가 육류, 와인, 냉동오렌지주스를 포함한 광범위한 미국산 제품에 큰 관세를 매기게 될 수도 있음. 트뤼도 총리...",1.7999999999999998,"[3] 미국 사우스 다코타주 농민연합, 캐나다 광우병 발생 언급하며 원산지표시제의 가치 확인 미국 사우스 다코타주 농민연합의 Doug Sombke 대표는 캐나다에서 발생한 광우병 사례가 원산지표시제(COOL)의 가치를 확인해주고 있다고 전함. Doug Sombke 대표는 캐나다가 의회에 COOL을 철회시키도록 로비활동을 벌여왔다고 전하면서 식품이 어디에서 유래했는지를 알려줄 법을 정부에서 철회하기를 진정으로 원하느냐고 되물었음. 지난 주, 캐나다 정부는 앨버타주에서 소 한 마리가 광우병에 걸린것을 확인했음. 사우사 다코타 농민연합은 소비자...",1.2,"[4] 캐나다 유콘주 농민, 정부에 GM 식품표시 촉구 유콘주의 한 농민이 연방정부에 유전자 변형시킨 모든 원료를 표시하도록 요구하는 청원을 하기 시작했음. 2주 전 청원웹사이트 'change.org'에서 시작된 이번 청원은 많은 과학자들이 유전자변형생물체가 들어있는 식품이 안전하다는데 대부분 합의했음에도 25,000명이 넘는 지지자들을 끌어모았음. 캐나다 방송사 CBC 프로 ""A New Day""는 화이트홀스 인근에서 목장을 운영하고 있는 농민 바바라 드루리씨가 청원을 시작하게된 이유를 쫓아보기로 했음. 1. 이 같은 청원을 하게 된 연유...",0.6,"[5] 미국 델라웨어 농식품단체, GMO 표시 규정 요구 미국 델라워어주 농식품 부문 대표단은 지난주 의회로 찾아가, 하나의 국가 유전자재조합식품(GMO) 표시기준을 통과시켜야 한다고 촉구했음.  식품안전연맹 회원들은 주별로 각기 다른 규정을 가지기 보다 국가차원의 규정을 마련토록 한 연방 법안을 요구하고 있음. 버몬트주는 표시기준을 시행할 예정이며, 다른 지역도 자체 표시 규정을 통과 또는 심의 중임.  제 1대 미국대두협회장 리차드 윌킨스씨는 대두 농부로서 지난 20여 년간 GMO 종자를 사용해왔는데, 농업 생산량을 안전하게 개선하는 ...",0.2198413372039795,"[6] 우루과이, 식품 이력추적제 방안 모색 우루과이 몬테비데오 시당국(IMM)은 식품제조업체에 식품 이력추적 계획 마련을 의무화하는 내용의 법령안을 2014년 11월에 승인했음. 법령안에 따르면, IMM은 식품 생산 단계부터 판매 단계까지 식품망 전반에 대한 관리를 담당하게 됨....",0.2127534866333008,"[7] 유럽의회, 집행위가 승인한 GM옥수수 1종 출시 반대 투표 유럽의회가 이번 수요일 집행위원회가 식품ㆍ사료용 글리포세이트 내성 유전자변형(GM)옥수수 NK603xT25에 내린 승인에 반대 투표 했음(찬성 403 반대 238 기권 50).  의회는 현행 승인 절차가 개선될 때까지 어떠한 GMO도 승인해서는 안된다는 입장임....",0.2011650085449219,"[8] 미국 아이다호주 상원, GMO 자율 표시 결의안 가결 미국 아이다호주 상원은 모든 유전자 변형 식품 표시는 자율적으로 이루어짐을 보장하도록 연방정부에 요구하고 있음. 금요일(현지 시각), 아이다호주 상원은 구두 표결에 따라 결의안을 통과시켰음.  짐 라이스 하원은 주마다 다른 법령은 제조업체에게 혼돈을 안겨주고 식량가 인상을 발생시킬 수 있다고 의원들에게 전했음. 라이스 하원은 미 식품의약품청(FDA)이 미국 전체에 적용되는 규칙 기준을 마련해야한다고 말했음. 하원은 지난 주 찬성 41표, 반대 24표로 가결시킨 바 있음....",0.20034461021423342,"[9] 미국 주정부농무부연합회, GM 식품에 대한 전국적 일괄 표시 정책 지지 미국 50개주와 미국령의 농업 위원회와 임원으로 구성된 미국 주정부농무부연합회(NASDA)는 유전자 변형(GM, genetically modified) 식품에 대한 전국적 일괄 표시 정책을 지지할 결의안을 통과시켰음. 동 결의안은 미국에서 유전 공학(genetic engineering) 유래 식품에 통일된 표시 정책을 갖기 위함임. 현재, 코네티컷 주와 버몬트 주 등은 자체 표시법을 통과시켰음. 주마다 상이한 표시 기준은 문제를 발생시킬 수 있음. 전국적인 기준...",0.0,,
1,"호주 ‘환타’ TV 광고 및 앱, 광고 기준 위반해",코카콜라사는 환타 TV 광고와 앱을 왜 삭제했나요?,(LLM 비활성화: 근거 문서만 제공),환타 TV 광고와 앱이 어린이 비만을 막기 위한 광고기준 지침을 위반했기 때문에 삭제했습니다.,True,1,2.602807068824768,"[1] 호주 ‘환타’ TV 광고 및 앱, 광고 기준 위반해 코카콜라(Coca-Cola)(사)의 환타(Fanta)는 TV 광고와 앱(app)이 어린이 비만을 막기 위한 광고기준 지침을 위반한다는 것을 안 뒤 해당 광고와 앱을 삭제했음.  ‘Fanta Tastes Like’ 캠페인은 거품 수영장에 뛰어들기, 롤러코스터 타기 등 재미있는 활동에 참여하는 만화 캐릭터들을 보여줌. 환타는 해당 캠페인이 15-17세의 십대를 겨냥한 것이라고 밝혔으나 호주광고기준위원회(Australian Advertising Standards Board)는 주로 어린...",2.602807068824768,"[2] 호주 ‘Uncle Tobys’, 귀리제품의 ‘슈퍼푸드’ 강조표시에 불리한 판결 받아 호주의 아침식사 제조업체이자 건강 바 브랜드인 ‘Uncle Tobys’는 자사 귀리제품을 “천연적으로 단백질이 풍부한 슈퍼푸드”라고 강조표시한 광고로 인해 곤란에 빠졌음. 호주 광고기준위원회는 6월 10일 해당 강조표시가 부정직하다고 결정했으며, ‘Uncle Tobys’를 소유한 ‘Cereal Partners(사)’는 TV 광고를 변경하는 것에 동의했음. 광고에서는 한 가족이 아침식사 시간에 귀리를 만들고 있으며, 누군가가 “우유와 함께 먹는 ‘Un...",1.7999999999999998,"[3] 미국 패스트푸드점 '인앤아웃', 식품배달업체 고소  미국 패스트푸드점 '인앤아웃' 버거가 식품배달업체 '도어대시'를 상표권침해와 불공정 경쟁을 들어 제소했음.  '도어대시'는 모바일앱과 웹사이트를 통해 외식업소의 식품을 주문할 수 있으나 '인앤아웃' 계열사가 아님에도 광고에 자사 로고를 흉내내 사용했다는 소장이 6일(현지시간) 캘리포니아 중앙지법에 접수되었음.  소장에 따르면 이 업체가 '인앤아웃'이 배달 서비스를 후원하고, 안전성과 식품 취급, 온도 기준에 맞게 배달되는지 감독하는 것처럼 행동했으나 실제와는 달랐음.  인앤아웃측은...",1.2,"[4] 영국, 코카콜라(사)가 '런던아이' 후원 업체로 나서자 공중보건 캠페인 단체 반발 코카콜라(사)가 영국 런던의 상징인 대관람차, '런던아이'의 후원업체로 나서자 공중보건 캠페인 단체가 크게 반발함. 지난 9월, 후원 계약이 이루어졌으며 런던아이는 유지 보수를 거쳐 이달 초에 재개장했음. 새로운 런던아이는 코카콜라를 상징하는 붉은 색으로 단장했으며 직원 유니폼 등 곳곳에서 코카콜라 로고를 볼 수 있다고 함.  이에 공중보건 캠페인 단체들은 코카콜라(사)가 런던아이를 이용해 한 캔에 9 티스푼에 달하는 당류가 함유되어 있는 음료 제품을...",0.6,"[5] 멕시코 연방보건보호위원회, 2014년 건강기능식품 불법 광고 천여 건 철회 조치 멕시코 연방보건보호위원회(Cofepris)는 지난 한 해동안 건강기능식품 불법 광고 1,119건에 대해 철회를 명령했음. 이 중 텔레비전 광고가 101건, 인쇄물 광고가 825건, 인터넷 및 라디오 광고가 31건, 영화관 광고가 2건임.  인터넷 중고거래 사이트에서 판매된 건강기능식품의 불법 광고 585건도 철회됨. 건강 관련 식품, 음료, 화장품 등이 대상임....",0.2112602710723877,"[6] 스페인 카탈루냐소비자원, 다농(사) Activia 제품 허위 광고로 고발 스페인 소비자사용자기구(OCU)는 카탈루냐소비자원(Agència Catalana del Consum)의 주장을 바탕으로 다농(사)의 제품인 액티비아(Activia)를 허위 광고로 고발했음.  OCU가 2013년 12월에 Activia 광고를 '입증되지 않은 정보 홍보'를 사유로 고발한데 이어 카탈루냐소비자원은 동 제품에 대한 소송 절차를 시작했다고 OCU에 통보했음.  프랑스는 3년 전에 Activia 광고를 금지한 바 있음. 광고의 내용은 매일 제품을 먹으면...",0.18365167379379274,"[7] 호주 유통업체 '콜스', 갓 구운 빵인 양 속여 팔아 벌금낼 처지 호주 경쟁소비자위원회(ACCC)는 빵의 신선도를 속여 판 유통업체 '콜스(Coles)'에 400만 달러 이상의 과태료를 부과해야 한다고 주장했음.  업체는 작년 제빵 제품에 '당일 구워, 당일 판매', '매장서 갓 구운'라고 허위 광고해 구매자들을 오인케 했다며 유죄를 선고받았음. 실제 일부 빵들은 수 개월 전 해외 공장에서 구워 냉동된 후 호주로 유통되었음.   3년 간 허위 표시된 빵 8500만 여개가 판매되어 3억 달러 가량의 수익을 올렸음. 경쟁소비자위원회는 ...",0.16984680891036988,"[8] 영국 방송광고실행위원회, 정크푸드 광고 금지 도입에 관한 의견수렴 실시 영국의 광고 규칙을 제정하는 정부기관이 온라인, 언론, 빌보드 및 포스터 사이트에 어린이를 상대로 한 정크푸드 광고를 금지해야할지 여부에 관한 공개 의견수렴을 2016년 초에 실시할 예정이라고 함. 텔레비전과 라디오를 제외한 모든 영국 매체 방송에 관한 기준을 제정하는 방송광고실행위원회(CAP)는 어린이를 상대로 지방과 식염, 당이 많이 든 식품과 음료 판촉에 대한 강력한 규칙 도입을 살피고 있음. 영국 광고기준청에 따르면, 지난 해 처음으로 영국에서 가장 많은...",0.16562058925628664,"[9] 영국심장재단, 어린이 시청 시간대 정크푸드 광고 금지 촉구 정크푸드 업체가 저녁 9시 이전에 TV 광고를 하는 것을 금지해야 한다고 영국심장재단(BHF)의 보건전문가들이 주장함. 현행 규제가 약해 부모들이 자녀에게 건강에 좋지 않은 식품과 당 함량이 높은 음료를 제공하도록 압박을 받고 있다고 함. 새로운 조사 결과에 따르면 4-16세 자녀를 둔 부모 10명 중 7명이 TV 광고때문에 자녀가 정크푸드를 사달라고 졸라 곤혹을 치른 바 있다고 답했음. 의사들과 노동당도 저녁 9시 이전 지방, 당, 식염 함량이 높은 제품의 광고를 금지하려...",0.0,,
2,"[회수]캐나다 Kam Wah Resources Co. Ltd., 알레르기 유발성분 우유 미표시한 코코넛즙 회수",Kam Wah Resources Co. Ltd.가 회수한 Coconut Juice의 회수일시는 언제인가요?,(LLM 비활성화: 근거 문서만 제공),2015.10.19,True,1,2.651666259765625,"[1] [회수]캐나다 Kam Wah Resources Co. Ltd., 알레르기 유발성분 우유 미표시한 코코넛즙 회수 - 회수일시: 2015.10.19- 유통지역: Manitoba, Ontario 소매점- 제품명: Coconut Juice (*브랜드명 없음, 중국어로만 표기, 1.25 l, UPC 6 927157 682160)- 회수사: Kam Wah Resources Co. Ltd....",2.651666259765625,"[2] [회수]캐나다 Kam Wah Resources Co. Ltd., 알레르기 유발성분인 우유 미표시로 막대사탕 회수 - 회수일시: 2015.6.11.- 유통지역: 온타리오주 소매점- 제품명:Lollipop Candy (200 g, 브랜드명 없음(중국어로만 기재), 코드 전체, UPC 6 911316 410503)- 회수사: Kam Wah Resources Co. Ltd.- 회수사유: 알레르기 유발성분인 우유 미표시- 기타: 본 회수는 한 것의 소비자 불만사례에서 비롯됨. 제품의 섭취와 관련된 부작용 보고건은 없음. 캐나다 식품검사청(C...",1.7999999999999998,"[3] [회수]캐나다 Kam Wah Resources Co. Ltd., 알레르기 유발성분 우유 미표시로 코코넛즙 회수 - 회수일시: 2015.9.29- 유통지역: Manitoba, Ontar 소매점- 제품명: 브랜드명 없음(중국어 표기) Coconut Juice (1.25 l, 제품코드 2015 05 20, UPC 6 927157 682160)- 회수사: Kam Wah Resources Co. Ltd.- 회수사유: 알레르기 유발성분 우유 미표시 ...",1.2,"[4] [회수]캐나다 Kam Wah Resources Co. Ltd., 알레르기 유발성분인 대두, 땅콩 미표시로 호두가루 회수 - 일시: 2015.12.9.- 지역: 캐나다 온타리오주 소매점- 제품명: Kaixin 브랜드 Walnut Powder (700 g, 로트 전체, UPC 6 923624 800686)- 회수사: Kam Wah Resources Co. Ltd.- 회수사유: 알레르기 유발성분인 땅콩 및 대두 미표시- 기타: 본 회수는 캐나다 식품검사청(CFIA)의 검사결과에 따른 것으로 캐나다에서는 상기 제품 섭취와 관련된 질병 신고...",0.6,"[5] [회수]캐나다 Kam Wah Resources Co. Ltd., 알레르기 유발성분 우유 미표시로 코코넛즙 회수 - 회수일시: 2015.9.29- 유통지역: Manitoba, Ontar 소매점- 제품명: 브랜드명 없음(중국어 표기) Coconut Juice (1.25 l, 제품코드 2015 05 20, UPC 6 927157 682160)- 회수사: Kam Wah Resources Co. Ltd.- 회수사유: 알레르기 유발성분 우유 미표시...",0.24215168952941896,"[6] [회수]캐나다 Kam Wah Resources Co. Ltd., 알레르기 유발성분인 글루텐 미표시한 볶은 건조대구 회수 - 회수일시: 2015.12.23- 유통지역: 온타리오 소매점- 브랜드명: Senior Fish - Qi Zhi Wei Food- 제품명: Dried Honey Roasted Cod (130 g, UPC 6 941882 502432)- 회수사: Kam Wah Resources Co. Ltd. - 회수사유: 알레르기 유발성분인 글루텐 미표시...",0.21233310699462893,"[7] [회수]캐나다 Kam Wah Resources Co. Ltd., 알레르기 유발성분인 땅콩 미표시로 조미료 회수 - 회수일시: 2015.6.10- 유통지역: 온타리오주 소매점- 제품명: Wong's 브랜드 Wangjiadu Dry Pan Condiment or Wangjiadu Spicy Condiment  (200 g, 제품코드 2015/01/03 07701, UPC 6 948637 500682)- 회수사: Kam Wah Resources Co. Ltd.- 회수사유: 알레르기 유발성분인 땅콩 미표시...",0.2079638719558716,"[8] [회수]캐나다 Kam Wah Resources Co. Ltd., 알레르기 유발성분 우유 미표시로 과자 회수 - 회수일시: 2015.9.25- 유통지역: 온타리오주 소매점- 제품명: Glico Pretz 브랜드 Biscuit Sticks (Salad Flavor) (65 g, 제품코드 S 2014.08.19 E5H, UPC 6 901845 040326)- 회수사: Kam Wah Resources Co. Ltd.- 회수사유: 알레르기 유발성분 우유 미표시...",0.20486092567443848,"[9] [회수]캐나다 Kam Wah Resources Co. Ltd., 알레르기 유발성분인 글루텐 미표시한 볶은 건조대구 회수 - 회수일시: 2015.12.23- 유통지역: 온타리오 소매점- 브랜드명: Senior Fish - Qi Zhi Wei Food- 제품명: Dried Honey Roasted Cod (130 g, UPC 6 941882 502432)- 회수사: Kam Wah Resources Co. Ltd. - 회수사유: 알레르기 유발성분인 글루텐 미표시 ...",0.0,,
3,"[회수]영국 Asda 등 5개(사), 글루텐 함유 가능성으로 '글루텐 미포함' 제품 여러종 회수",Asda에서 회수된 제품 중 'Asda Chosen by you 4 Free From White Pitta Breads'의 최적소비기한은 언제인가요?,(LLM 비활성화: 근거 문서만 제공),"2015.06.26, 2015.06.30, 2015.07.02",True,1,2.4,"[1] [회수]영국 Asda 등 5개(사), 글루텐 함유 가능성으로 '글루텐 미포함' 제품 여러종 회수 - 일시: 2015.06.07.- 제품명, 최적소비기한 1. Asda(사)  1) Asda Chosen by you 4 Free From White Pitta Breads, 2015.06.26/ 2015.06.30/ 2015.07.02, 바코드: 505244989731  2) Asda Chosen by you 2 Free From Garlic  Coriander Naan Breads, 2015.07.03/ 2015.07.07/ 2015....",2.4,"[2] [회수]영국 Asda 등 6개(사), 글루텐 함유 가능성으로 '글루텐 미포함' 제품 여러종 회수(업데이트) *2015년 6월 7일자 영국 회수정보에서 업데이트 되었음 - 일시: 2015.06.10.- 제품명, 최적소비기한1. Genius Foods(사)  1) Genius Crumpets, 2015.06.18~2016.06.26  2) Livwell Gluten Free Crumpets, 2015.06.18~2015.06.26  3) Livwell Garlic Naan, 2015.07.09~2015.08.28 1. Asda(사)  ...",1.7999999999999998,"[3] [회수]영국 Asda, 클로스트리디움 보툴리늄 오염 위험으로 비트 피클 회수 - 일시: 2015.09.16- 제품명: Pickled Crinkle Cut Beetroot (710g, 바코드: 505407035908, 배치코드: 4340, 최적소비기한: 2016.12.06)- 브랜드명: Asda(사) Chosen By You- 회수사: Asda- 회수사유: 클로스트리디움 보툴리늄 오염 위험...",1.2,"[4] [회수]영국 Purity Soft Drinks Ltd, 깨진 유리 조각 혼입 가능성으로 음료수 회수 - 일시: 2015.07.16.- 제품명: Firefly Lemon, Lime and Ginger Natural Drink (330ml, 유리병, 배치코드: 5029, 최적소비기한: 2016년 4월)- 회수사: Purity Soft Drinks Ltd - 회수사유: 병 입구 가장자리의 깨진 유리 조각 혼입 가능성- 기타: 해당 제품은 Asda 점포에만 유통되었음- 제품사진: http://www.food.gov.uk/sites/defa...",0.6,"[5] [회수]영국 Asda, 알레르기 유발성분 아황산 미표시로 대추야자 회수 - 일시: 2015.08.20- 제품명: Good  Balanced Dates (250g, 전 최적소비기한)- 브랜드명: Asda- 회수사: Asda- 회수사유: 알레르기 유발성분 아황산 미표시- 제품사진: http://www.food.gov.uk/sites/default/files/asda-good-balanced-dates.pdf...",0.19723243713378907,"[6] [회수]영국 Asda, 알레르기 유발성분 우유 미표시로 소스 회수 - 일시: 2015.12.16- 제품명: Asda Chip Shop Curry Sauce Mix (160g, 최적소비기한: 2016년 10월, 배치코드: 5291)- 브랜드명: Asda- 회수사: Asda- 회수사유: 알레르기 유발성분 우유 미표시- 제품사진: http://www.food.gov.uk/sites/default/files/prn-asda-currysauce.pdf...",0.1831032156944275,"[7] [회수]영국 Asda, 알레르기 유발성분 달걀과 우유 미표시로 즉석 섭취 샐러드 회수 - 일시: 2015.1.27- 제품명: Sundried Tomato Cous Cous(310g, 바코드: 505407000676, 유통기한: 2015.2.2)- 브랜드명: Asda - 회수사: Asda - 회수사유: 알레르기 유발성분 달걀과 우유 미표시...",0.18160414695739746,"[8] [회수]영국 Asda, 날새우 혼입 가능성으로 조리새우 제품 회수 - 일시: 2015.6.5- 제품명: Asda Cooked and Peeled King Prawns (180g, 바코드: 5052449318166, 소비기한: 2015.06.07)- 브랜드명: Asda- 회수사: Asda.- 회수사유: 조리새우 일부 제품에 날새우 혼입 가능성...",0.1814611315727234,"[9] [회수]영국 Asda, 플라스틱 조각 혼입 가능성으로 버터 스프레드 회수 - 일시: 2015.11.6- 지역: - - 제품명: Asda Buttery Spread (바코드 505407048345, 포장 500g, 유통기한 ~2015.12.28)- 회수사: Asda - 회수사유: 투명하고 딱딱한 플라스틱 조각이 일부 포장에 혼입되었을 가능성이 있음- 제품사진: http://www.food.gov.uk/sites/default/files/prn-asda-buttery-spread.pdf...",0.17945284843444825,"[10] 영국 대형 유통업체, 수입산 양고기 영국산으로 오표기 판매 사과 영국의 대형 유통업체 Asda는 스코틀랜드 보더스(Borders) 지역 매장에서 수입산 양고기가 영국에서 출생, 사육, 도축된 것으로 라벨에 잘못 표시되어 판매된 것에 대해 사과를 표명함. 해당 표기오류는 한 구매자가 포장에 영국산으로 표시된 양고기에 뉴질랜드 소인이 찍혀있는 것을 발견하여 밝혀짐. Asda 대변인은 양고기 다리에 라벨이 잘 못 부착된 것은 단일 사건이자 인적 과실이었고 고의적으로 고객을 오도할 의도는 없었다고 해명함. 또한 실수가 발생하지 않도록 매장...",0.0
